Theory,Slug,Collection ID,Item ID,Archived,Draft,Created On,Updated On,Published On,Breadcrumb Link,Quote,Block Quote,Sort Order,Emoji,Text Emoji,Meta-Narrative,Logic,Short Description,Power Dynamic,Politics Theory,Political Theory Description,Economics theory,Economics short description,Culture theory,Culture short description,Ecology theory,Ecology short description,💡 Self enquiry,Diagnosis questions,Related variables,Organ,Rationale,Extraction/Cultivation,Defense/Propagation,🩻 Tetrad Central Claim,🩻 Tetrad Analysis,Partial diagnosis,🎓 Case Study,📚 Literature RTF,🔮 Research Circles,🧊 Life Course,🪪 Universal Human Rights,Four Yogas
Rewilding,20t,68d43be19861a99025b311ef,68da9a25cf83b67e61eff365,false,false,Mon Sep 29 2025 14:39:33 GMT+0000 (Coordinated Universal Time),Sun Nov 23 2025 22:33:34 GMT+0000 (Coordinated Universal Time),Sun Nov 23 2025 22:34:12 GMT+0000 (Coordinated Universal Time),https://www.solarpunksangha.com/academy/meta-narratives/sustainable-future,"<p id=""""><em id="""">""The wise see knowledge and action as one; they see truly. Take either path and you go astray.""</em> — <strong id="""">Bhagavad Gita 5.4</strong> (On integrated being/action)</p>","""The wise see knowledge and action as one; they see truly. Take either path and you go astray."" — Bhagavad Gita 5.4 (On integrated being/action)",23,https://cdn.prod.website-files.com/64a6e8d0934bf5388f56b867/68da9da109a7b247cf55a39c_Rewilding.avif,🧑🏽‍🎤,✴️ Symbiotic Commonwealth,Systemic Expressions,The Liberation Process: Restoring agency and diversity at all levels.,Restores autonomy by rebuilding self-organizing capacity—circulating control back to communities and ecosystems.,Community Autonomy,Self-governance,Commons-based Production,Shared stewardship,Holistic Identity,Integrated being,Biodiversity,Full ecological expression,"<p id="""">What skills or resources could I contribute to a system of <strong>Commons-based Production</strong> that would increase my community's <strong>Community Autonomy</strong>, and how would this help me develop a more <strong>Holistic Identity</strong> beyond being a consumer?</p>","<p id="""">1. Do systems recover from shocks with increased capability?</p><p id="""">2. Does diversity increase during stress?</p><p id="""">3. Are there multiple pathways for essential functions?</p>","<p id="""">- Community resilience to crises</p><p id="""">- Innovation rate during challenges</p><p id="""">- Redundancy and diversity metrics</p>","<p id=""""><strong id="""">The Sovereign Spine</strong> </p><p id="""">Capacity for Self-Organization </p>",<p>To build antifragile systems that gain strength from disturbance through distributed intelligence.</p>,"<p>Returning land to wilderness, fostering community autonomy, and unlearning domestication.</p>","<p><strong id="""">Feral Resilience:</strong> The innate ability to self-organize, resist control, and regenerate from the bottom up.</p>",Restoring agency and diversity at all levels,"<ul id=""""><li id=""""><strong id="""">Object of Perception:</strong> Agency / Diversity</li><li id=""""><strong id="""">ENHANCES:</strong> Autonomy; self-organization; biodiversity; resilience; creativity</li><li id=""""><strong id="""">OBSOLESCES:</strong> Control; standardization; monoculture; dependence</li><li id=""""><strong id="""">RETRIEVES:</strong> Feral intelligence and wildness in context of human co-existence</li><li id=""""><strong id="""">REVERSES INTO:</strong> System becomes antifragile—thriving on disturbance and change</li></ul><p id=""""></p>","<p id=""""><strong>Ecological Nervous System</strong>: Systems regain their self-organizing intelligence through distributed autonomy and biodiversity of approaches.</p>","<p id="""">Indigenous Forest Management in Pacific Northwest (ongoing)</p><p id="""">Traditional ecological knowledge of Coast Salish peoples demonstrates symbiotic ethos through controlled burning practices that increase biodiversity, salmon habitat restoration that benefits entire watersheds, and governance systems based on seven-generation thinking.</p><p id=""""><em id="""">Sources: </em><a href=""https://nwifc.org/"" target=""_blank"" id="""">Northwest Indian Fisheries Commission</a> | <a href=""https://www.traditionalanimalfoods.org/"" target=""_blank"" id="""">Traditional Ecological Knowledge Institute</a> | <a href=""https://depts.washington.edu/ntplants/"" target=""_blank"">University of Washington Ethnobotany</a></p>","<p id=""""><strong>""Feral: Rewilding the Land, the Sea, and Human Life""</strong> by George Monbiot (2013)</p><p id="""">Monbiot explores how rewilding landscapes and human communities can restore biodiversity and community autonomy, moving beyond mere conservation toward dynamic ecological and social regeneration.</p>",business-organizations,daily-life-employment,,Raja
Dialogic,21t,68d43be19861a99025b311ef,68da9a25da8d5af9e99cf2da,false,false,Mon Sep 29 2025 14:39:33 GMT+0000 (Coordinated Universal Time),Sun Nov 23 2025 22:33:35 GMT+0000 (Coordinated Universal Time),Sun Nov 23 2025 22:34:12 GMT+0000 (Coordinated Universal Time),https://www.solarpunksangha.com/academy/meta-narratives/sustainable-future,"<p id=""""><em id="""">""The word is the supreme Brahman... The one who offers a word-sacrifice attains to the world of words.""</em> — <strong id="""">Rig Veda</strong> (On the creative power of speech)</p>","""The word is the supreme Brahman... The one who offers a word-sacrifice attains to the world of words."" — Rig Veda (On the creative power of speech)",24,https://cdn.prod.website-files.com/64a6e8d0934bf5388f56b867/68da9dc2aeaac6072f272eec_Synthalogic.avif,👩🏾‍🏫,✴️ Symbiotic Commonwealth,Systemic Expressions,The Pro-Solidarity Framework: Actively building collective intelligence.,"Builds solidarity through generative conflict—circulating understanding through respectful, multi-perspective dialogue.",Solidarity Networks,Mutual support systems,Mutual Aid,Worker-owned enterprises,Intercultural Dialogue,Respectful exchange,Co-evolution,Learning from nature's wisdom,"<p id="""">How can I help build or strengthen <strong>Solidarity Networks</strong> and <strong>Mutual Aid</strong> in my neighborhood, and what would genuine <strong>Intercultural Dialogue</strong> require of me to ensure we <strong>Co-evolve</strong> rather than assimilate?</p>","<p id="""">1. Do communities self-organize during crises?</p><p id="""">2. Does cultural exchange strengthen all participants?</p><p id="""">3. Are differences leveraged as collective intelligence?</p>","<p id="""">- Mutual aid network density</p><p id="""">- Cross-cultural collaboration rates</p><p id="""">- Collective problem-solving capacity</p>","<p id=""""><strong id="""">The Vocal Commons</strong> </p><p id="""">Capacity for Co-Creative Speech</p>",<p>To ensure our collective intelligence is greater than the sum of our individual intelligences.</p>,"<p>Citizen assemblies, intercultural dialogue, and non-violent communication practices.</p>","<p><strong id="""">Generative Listening:</strong> Creating a container where every voice can be heard, disarming monologue and propaganda.</p>",Actively building collective intelligence,"<ul id=""""><li id=""""><strong id="""">Object of Perception:</strong> Communication</li><li id=""""><strong id="""">ENHANCES:</strong> Mutual understanding; collective problem-solving; intercultural learning; co-evolution</li><li id=""""><strong id="""">OBSOLESCES:</strong> Monologue; propaganda; manipulation; cultural imperialism</li><li id=""""><strong id="""">RETRIEVES:</strong> Ancient dialogue arts enhanced by modern communication tools</li><li id=""""><strong id="""">REVERSES INTO:</strong> Continuous, emergent innovation and wisdom through dialogue</li></ul><p id=""""></p>","<p id=""""><strong>Collaborative Immune System</strong>: Mutual aid and intercultural dialogue create social antibodies that protect against division and exploitation.</p>","<p id="""">Zapatista Autonomous Municipalities (1994-present)</p><p id="""">The Zapatista communities in Chiapas, Mexico exemplify synthalogic through autonomous solidarity networks, mutual aid systems for healthcare and education, ongoing intercultural dialogue between indigenous and mestizo communities, and co-evolutionary development of democratic practices.</p><p id=""""><em id="""">Sources: </em><a href=""https://schoolsforchiapas.org/"" target=""_blank"" id="""">Schools for Chiapas</a> | <a href=""https://cepr.net/mexico/"" target=""_blank"" id="""">Center for Economic and Policy Research</a> | <a href=""https://enlacezapatista.ezln.org.mx/"" target=""_blank"">Zapatista Documentation Project</a></p>","<p id=""""><strong>""Mutual Aid: A Factor of Evolution""</strong> by Peter Kropotkin (1902)</p><p id="""">Kropotkin's foundational text demonstrates how cooperation and mutual aid are primary drivers of evolution and social development, providing theoretical basis for solidarity networks and intercultural dialogue.</p>",research-based-institutions,citizenship-advocacy,,Jnana
Resilience,22t,68d43be19861a99025b311ef,68da9a253d54f3c3a9bf61c0,false,false,Mon Sep 29 2025 14:39:33 GMT+0000 (Coordinated Universal Time),Sun Nov 23 2025 22:33:35 GMT+0000 (Coordinated Universal Time),Sun Nov 23 2025 22:34:12 GMT+0000 (Coordinated Universal Time),https://www.solarpunksangha.com/academy/meta-narratives/sustainable-future,"<p id=""""><em id="""">""The bamboo that bends is stronger than the oak that resists.""</em> — <strong id="""">Japanese Proverb</strong> (reflecting Taoist/Buddhist thought)</p>","""The bamboo that bends is stronger than the oak that resists."" — Japanese Proverb (reflecting Taoist/Buddhist thought)",25,https://cdn.prod.website-files.com/64a6e8d0934bf5388f56b867/68da9dd8e90ac9d4e679ccc7_Resilience.avif,🏗️,✴️ Symbiotic Commonwealth,Systemic Expressions,"Engineered Resilience: Creating redundant, adaptable systems.","Distributes intelligence through redundancy—circulating adaptive capacity across networks, skills, and knowledge.",Distributed Networks,Capacity building,Localized Production,Community ownership,Knowledge Commons,Strong communities,Polyculture,Restoring mythic expression,"<p>What is one step I can take to move from brittle dependence to resilient Distributed Networks, whether by supporting Localized Production, contributing to a Knowledge Commons, or learning a practical skill?    -</p>","<p id="""">1. Are essential needs met locally during disruptions?</p><p id="""">2. Does knowledge flow freely where needed?</p><p id="""">3. Do multiple approaches coexist for key functions?</p>",<p>- Local self-sufficiency indexes- Knowledge sharing velocity- Adaptive capacity measurements</p>,"<p id=""""><strong id="""">The Distributed Immune System</strong> </p><p id="""">Capacity for Adaptive Response</p>","<p>To create systems that can withstand and learn from shocks, rather than shattering.</p>","<p>Localized production, knowledge commons, and polycultural (diverse) approaches to problem-solving.</p>","<p><strong id="""">Antifragile Learning:</strong> The system's ability to not just bounce back, but to incorporate stressors into its design, becoming stronger.</p>","Creating redundant, adaptable systems","<ul id=""""><li id=""""><strong id="""">Object of Perception:</strong> System Response to Stress</li><li id=""""><strong id="""">ENHANCES:</strong> Adaptive capacity; redundancy; distributed intelligence; learning from failure</li><li id=""""><strong id="""">OBSOLESCES:</strong> Brittle optimization; centralization; efficiency at resilience cost</li><li id=""""><strong id="""">RETRIEVES:</strong> Traditional resilient systems knowledge combined with modern science</li><li id=""""><strong id="""">REVERSES INTO:</strong> Systems become antifragile, gaining from stressors</li></ul>","<p id=""""><strong>Distributed Vitality</strong>: Capacity is built at all scales through localized production, knowledge commons, and polycultural approaches.</p>","<p id="""">Cuban Urban Agriculture (1990s-present)</p><p id="""">Cuba's response to the ""Special Period"" economic crisis demonstrates resilience through distributed urban farming networks, localized food production in cities, knowledge commons sharing of permaculture techniques, and polyculture approaches that increased food security while reducing environmental impact.</p><p id=""""><em id="""">Sources: </em><a href=""http://www.fao.org/urban-agriculture/en/"" target=""_blank"" id="""">Food and Agriculture Organization</a> | <a href=""http://www.actaf.co.cu/"" target=""_blank"" id="""">Cuban Association of Agricultural and Forestry Technicians</a> | <a href=""https://www.cambridge.org/core/journals/renewable-agriculture-and-food-systems"" target=""_blank"" id="""">Sustainable Agriculture Research</a></p><p id="""">‍</p>","<p id=""""><strong>""Resilience: Why Things Bounce Back""</strong> by Andrew Zolli and Ann Marie Healy (2012)</p><p id="""">This book explores how distributed networks, localized production systems, shared knowledge commons, and diverse polyculture approaches create antifragile systems that grow stronger through stress.</p>",governance-institutions,daily-life-employment,,Raja
Commons Strategy,23t,68d43be19861a99025b311ef,68da9a2518c5b16a34209fba,false,false,Mon Sep 29 2025 14:39:33 GMT+0000 (Coordinated Universal Time),Sun Nov 23 2025 22:33:34 GMT+0000 (Coordinated Universal Time),Sun Nov 23 2025 22:34:12 GMT+0000 (Coordinated Universal Time),https://www.solarpunksangha.com/academy/meta-narratives/sustainable-future,"<p id=""""><em id="""">""The householder should regard all creatures as his own self, and distribute food to them all.""</em> — <strong id="""">Taittiriya Upanishad</strong></p>","""The householder should regard all creatures as his own self, and distribute food to them all."" — Taittiriya Upanishad",26,https://cdn.prod.website-files.com/64a6e8d0934bf5388f56b867/68da9dfbfcbf41263b99d3dc_Commons%20Strategy.avif,⛲,✴️ Symbiotic Commonwealth,Operational Mechanisms,The Commons-Based Tools: Managing resources through community governance.,"Circulates wealth through shared stewardship—money as a commons, not a tool of extraction.",Citizen Assemblies,Everyday people governing together,Cooperative Ownership,Workers own their labor,Open Source Culture,"Knowledge shared, no monopolized",Ecosystem Services,Inherent natural value,"<p id="""">How could models like <strong>Cooperative Ownership</strong> and <strong>Citizen Assemblies</strong> be applied to solve a specific problem in my community, and how do we properly value the <strong>Ecosystem Services</strong> that support all life?</p>","<p id="""">1. Do resources circulate or accumulate?</p><p id="""">2. Are needs met through participation or possession?</p><p id="""">3. Does ownership create stewards or hoarders?</p>","<p id="""">- Commons governance effectiveness</p><p id="""">- Resource circulation velocity</p><p id="""">- Wealth concentration trends</p>","<p id=""""><strong id="""">The Circulatory System</strong> </p><p id="""">Capacity for Equitable Flow</p>","<p>To ensure wealth and knowledge circulate as commonwealth, nourishing the entire community.</p>","<p>Community land trusts, mutual credit systems, and participatory budgeting.</p>","<p><strong id="""">Commoning:</strong> The social practice of collectively managing a resource, which inherently defends against privatization.</p>",Managing resources through community governance,"<ul id=""""><li id=""""><strong id="""">Object of Perception:</strong> Resource Management</li><li id=""""><strong id="""">ENHANCES:</strong> Equitable distribution; stewardship; circular flows; community governance</li><li id=""""><strong id="""">OBSOLESCES:</strong> Private enclosure; state bureaucracy; resource hoarding</li><li id=""""><strong id="""">RETRIEVES:</strong> Medieval/indigenous commons with modern institutional design</li><li id=""""><strong id="""">REVERSES INTO:</strong> Commons becomes primary mode, rendering state/market models secondary</li></ul><p id=""""></p>","<p id=""""><strong>Circulatory Health</strong>: Resources flow through commons-based systems that prevent hoarding and ensure equitable distribution.</p>","<p id="""">Participatory Budgeting in Porto Alegre (1989-present)</p><p id="""">Brazil's pioneering participatory budgeting process demonstrates commons strategy through citizen assemblies that allocate municipal resources, cooperative ownership of decision-making processes, open source methodology adopted globally, and explicit attention to urban ecosystem services.</p><p id=""""><em id="""">Sources: </em><a href=""https://www.participatorybudgeting.org/"" target=""_blank"" id="""">Participatory Budgeting Project</a> | <a href=""https://www.worldbank.org/en/topic/urbandevelopment"" target=""_blank"" id="""">World Bank Urban Development</a> | <a href=""https://www.iap2.org/"" target=""_blank"" id="""">International Association for Public Participation</a></p><p id="""">‍</p>","<p id=""""><strong>""Governing the Commons""</strong> by Elinor Ostrom (1990)</p><p id="""">Ostrom's Nobel Prize-winning analysis of how communities successfully manage shared resources through institutional arrangements that avoid both market failures and government control.</p>",business-organizations,daily-life-employment,,Karma
Guided Activity,24t,68d43be19861a99025b311ef,68da9a254ea29ed5c34d0e62,false,false,Mon Sep 29 2025 14:39:33 GMT+0000 (Coordinated Universal Time),Sun Nov 23 2025 22:33:35 GMT+0000 (Coordinated Universal Time),Sun Nov 23 2025 22:34:12 GMT+0000 (Coordinated Universal Time),https://www.solarpunksangha.com/academy/meta-narratives/sustainable-future,"<p id=""""><em id="""">""Strive earnestly to be filled with compassion. Regard others as equal to yourself.""</em> — <strong id="""">The Buddha, Samyutta Nikaya</strong></p>","""Strive earnestly to be filled with compassion. Regard others as equal to yourself."" — The Buddha, Samyutta Nikaya",27,https://cdn.prod.website-files.com/64a6e8d0934bf5388f56b867/68da9e0ccf83b67e61f16681_Guided%20Activity.avif,🎍,✴️ Symbiotic Commonwealth,Operational Mechanisms,Direct Nurturance: Activities that build community and ecological health.,Nurtures alignment through care and invitation—circulating safety as a shared responsibility.,Restorative Justice,Healing harm,Universal Basic Services,Local prosperity,Radical Inclusion,Embracing diversity,Regeneration,Healing damaged systems,"<p id="""">How would access to <strong>Universal Basic Services</strong> change the possibilities in my life, and what would it take to replace punitive systems with <strong>Restorative Justice</strong> and <strong>Radical Inclusion</strong> in my circles?</p>","<p id="""">1. Do interventions repair harm and relationships?</p><p id="""">2. Does inclusion strengthen community fabric?</p><p id="""">3. Are basic services treated as rights?</p>","<p id="""">- Restorative justice outcomes</p><p id="""">- Social inclusion metrics</p><p id="""">- Universal service access rates</p>","<p id=""""><strong id="""">The Hands of Nurturance</strong> </p><p id="""">Capacity for Active Care</p>","<p>To constantly repair the social and ecological fabric, strengthening the whole.</p>","<p>Universal basic services, radical inclusion policies, and ecosystem restoration work.</p>","<p><strong id="""">Solidarity in Action:</strong> The community's reflexive response to uplift any member facing hardship, preventing isolation.</p>",Activities that build community and ecological health,"<ul id=""""><li id=""""><strong id="""">Object of Perception:</strong> Social Interventions</li><li id=""""><strong id="""">ENHANCES:</strong> Healing; inclusion; regeneration; community building; dignity</li><li id=""""><strong id="""">OBSOLESCES:</strong> Punitive measures; exclusion; degradation; social fragmentation</li><li id=""""><strong id="""">RETRIEVES:</strong> Ancient community healing practices integrated into modern institutions</li><li id=""""><strong id="""">REVERSES INTO:</strong> Nurturing activities make punitive systems obsolete</li></ul><p id=""""></p>","<p id=""""><strong>Healing Interventions</strong>: Justice restores rather than punishes; inclusion creates belonging; services ensure dignity for all.</p>","<p id="""">Finland's Comprehensive Social Services Model (2000s-present)</p><p id="""">Finland's integration of universal basic services (housing, healthcare, education), restorative justice practices in schools and communities, radical inclusion policies for immigrants and marginalized populations, and regenerative approaches to social policy demonstrates guided activity principles.</p><p id=""""><em id="""">Sources:</em> <a href=""https://www.kela.fi/web/en"" target=""_blank"" id="""">KELA (Social Insurance Institution of Finland)</a> | <a href=""https://www.oph.fi/en"" target=""_blank"" id="""">Finnish National Agency for Education</a> | <a href=""https://www.norden.org/en"" target=""_blank"">Nordic Council of Ministers</a></p>","<p id=""""><strong>""The Little Book of Restorative Justice""</strong> by Howard Zehr (2015)</p><p id="""">Zehr's foundational text on restorative justice provides framework for guided activity that heals harm through community-centered processes rather than punitive systems.</p>",civil-society,safety-security,,Karma
Appropriate Technology,25t,68d43be19861a99025b311ef,68da9a25d2ae11412cf15728,false,false,Mon Sep 29 2025 14:39:33 GMT+0000 (Coordinated Universal Time),Sun Nov 23 2025 22:33:34 GMT+0000 (Coordinated Universal Time),Sun Nov 23 2025 22:34:12 GMT+0000 (Coordinated Universal Time),https://www.solarpunksangha.com/academy/meta-narratives/sustainable-future,"<p id=""""><em id="""">""The craftsman, having first established the truth within his own self, creates accordingly.""</em> — <strong id="""">Rig Veda</strong> (On mindful creation)</p>","""The craftsman, having first established the truth within his own self, creates accordingly."" — Rig Veda (On mindful creation)",28,https://cdn.prod.website-files.com/64a6e8d0934bf5388f56b867/68da9e25335945e113301471_Appropriate%20Technology.avif,🧰,✴️ Symbiotic Commonwealth,Operational Mechanisms,The Liberatory Tech: Tools that enhance human agency and ecological wisdom.,"Empowers through open, repairable, community-controlled tools—circulating technological sovereignty and agency.",Digital Commons,"Our data, our shared resources",Open Source Hardware,"Repair, modify, understanding tools",Attention Sovereignty,Control your own focus,Appropriate Scale,Technology serving life,"<p id="""">What does <strong>Attention Sovereignty</strong> mean to me, and how can I use or support <strong>Appropriate Technology</strong> and <strong>Open Source Hardware</strong> to reclaim it from corporate platforms?</p>","<p id="""">1. Does technology increase autonomy or dependence?</p><p id="""">2. Can tools be understood, modified, and repaired by users?</p><p id="""">3. Does tech scale enhance or diminish life?</p>","<p id="""">- Technology accessibility and literacy</p><p id="""">- Repair and modification rates</p><p id="""">- Ecological impact of tech systems</p>","<p id=""""><strong id="""">The Liberatory Tools</strong> </p><p id="""">Capacity for Augmented Agency</p>","<p>To create tools that serve life, enhance understanding, and remain under community control.</p>","<p>Open-source hardware, digital commons, and design principles favoring repairability and appropriate scale.</p>","<p><strong id="""">Sovereign Toolmaking:</strong> The community's ability to understand, modify, and control its own technological means.</p>",Tools that enhance human agency and ecological wisdom,"<ul id=""""><li id=""""><strong id="""">Object of Perception:</strong> Technology</li><li id=""""><strong id="""">ENHANCES:</strong> Autonomy; understanding; repairability; ecological integration; human scale</li><li id=""""><strong id="""">OBSOLESCES:</strong> Dependence; obscurity; planned obsolescence; ecological harm</li><li id=""""><strong id="""">RETRIEVES:</strong> Craft traditions augmented with open-source and digital fabrication</li><li id=""""><strong id="""">REVERSES INTO:</strong> Technology becomes seamlessly integrated into life without dominating it</li></ul>","<p id=""""><strong>Symbiotic Tools</strong>: Technology serves life—digital commons protect data sovereignty, open hardware enables repair, scale matches ecological context.</p>","<p id="""">FarmBot Open Source Farming Robot (2011-present)</p><p id="""">FarmBot demonstrates appropriate technology through open source hardware designs for precision agriculture, digital commons sharing of farming knowledge, attention sovereignty by reducing time spent on routine tasks, and appropriate scale technology accessible to home gardeners and small farms.</p><p id=""""><em id="""">Sources: </em><a href=""https://software.farm.bot/docs"" target=""_blank"" id="""">FarmBot Documentation</a> | <a href=""https://www.opensourceecology.org/"" target=""_blank"" id="""">Open Source Ecology</a> | <a href=""https://www.media.mit.edu/groups/open-agriculture-openag/overview/"" target=""_blank"">MIT OpenAg Initiative</a></p>","<p id=""""><strong>""Small is Beautiful: Economics as if People Mattered""</strong> by E.F. Schumacher (1973)</p><p id="""">Schumacher's seminal work on intermediate technology emphasizes human-scale, environmentally sustainable, and locally adaptable technologies that serve community needs rather than maximizing profit or efficiency.</p>",research-based-institutions,daily-life-employment,,Karma
