Theory,Slug,Collection ID,Item ID,Archived,Draft,Created On,Updated On,Published On,Breadcrumb Link,Quote,Block Quote,Sort Order,Emoji,Text Emoji,Meta-Narrative,Logic,Short Description,Power Dynamic,Politics Theory,Political Theory Description,Economics theory,Economics short description,Culture theory,Culture short description,Ecology theory,Ecology short description,💡 Self enquiry,Diagnosis questions,Related variables,Organ,Rationale,Extraction/Cultivation,Defense/Propagation,🩻 Tetrad Central Claim,🩻 Tetrad Analysis,Partial diagnosis,🎓 Case Study,📚 Literature RTF,🔮 Research Circles,🧊 Life Course,🪪 Universal Human Rights,Four Yogas
Steering Activity,10t,68d43be19861a99025b311ef,68da9a2460ac25384f1fc26a,false,false,Mon Sep 29 2025 14:39:32 GMT+0000 (Coordinated Universal Time),Sun Nov 23 2025 22:33:35 GMT+0000 (Coordinated Universal Time),Sun Nov 23 2025 22:34:12 GMT+0000 (Coordinated Universal Time),https://www.solarpunksangha.com/academy/meta-narratives/the-necrocene,"<p id="""">""They force us to bomb these areas by operating from civilian locations.""</p>","""They force us to bomb these areas by operating from civilian locations.""",11,https://cdn.prod.website-files.com/64a6e8d0934bf5388f56b867/68da9c4e4d7e4de647e09eec_Steering%20Activity.png,👮‍♂️,🦠 Necrocene,Operational Mechanisms,Direct Enforcement: Activities that actively reinforce hierarchical power.,Enforces compliance through violence and threat—hoarding the monopoly on legitimate force.,Violence,Physical coercion,Poverty,Structural deprivation,Exclusion,Social marginalization,Undeath,Living degradation,"<p id="""">Is the systemic production of <strong>Poverty</strong> and <strong>Exclusion</strong> a policy failure, or is it a form of <strong>Steering Activity</strong> that maintains a social order by channeling energy into mere survival (<strong>Undeath</strong>) rather than liberation?</p>","<p id="""">1. Is violence institutionalized (e.g., in policing, economics)?</p><p id="""">2. Are there visible and invisible forms of coercion?</p><p id="""">3. Does the system create ""walking dead"" (undeath) through deprivation?</p>","<p id="""">- Violence-related mortality</p><p id="""">- Poverty and unemployment rates</p><p id="""">- Access to healthcare and education</p>","<p id=""""><strong id="""">The Feet</strong></p><p id="""">Capacity for Movement &amp; Flight</p>",<p>To channel all of Their energy into mere survival.</p>,"<p>Systematic bombing of evacuation routes, shelters, hospitals, and aid distribution points.</p>","<p id=""""><strong id="""">Blaming the Victim</strong>: Framing the destruction of life-support systems as Hamas's human shields strategy.</p>",Direct enforcement activities that reinforce hierarchical power,"<ul id=""""><li id=""""><strong id="""">Object of Perception:</strong> Social Energy</li><li id=""""><strong id="""">ENHANCES:</strong> Social control; channeling energy into survival rather than liberation</li><li id=""""><strong id="""">OBSOLESCES:</strong> Voluntary cooperation; intrinsic motivation; creative potential</li><li id=""""><strong id="""">RETRIEVES:</strong> Overt authoritarian control masked as ""law and order"" or ""crisis management""</li><li id=""""><strong id="""">REVERSES INTO:</strong> Pervasive resistance and system-wide friction as coercion becomes primary social glue</li></ul>","<p>Directed Violence: System steers through overt and covert violence—poverty, exclusion, and structural deprivation—to maintain control.</p>","<p id="""">War on Drugs (1971-present)</p><p id="""">The decades-long ""War on Drugs"" exemplifies steering activity through state violence, poverty maintenance, systematic exclusion from civic participation, and creating populations of the ""living dead"" through permanent criminal status.</p><p id=""""><em id="""">Sources: </em><a href=""https://drugpolicy.org/issues/brief-history-drug-war"" target=""_blank"" id="""">Drug Policy Alliance</a> | <a href=""https://www.sentencingproject.org/research/drug-policy/"" target=""_blank"" id="""">Sentencing Project Statistics</a> | <a href=""https://bjs.ojp.gov/drugs-and-crime-facts"" target=""_blank"">Bureau of Justice Statistics</a></p>","<p id=""""><strong id="""">""The New Jim Crow"" </strong>by Michelle Alexander (2010)</p><p id="""">Alexander's analysis of mass incarceration reveals how steering activity operates through systematic violence, engineered poverty, social exclusion, and the creation of ""undeath"" - a civil death that persists beyond prison.</p>",governance-institutions,safety-security,,Karma
Technocognition,11t,68d43be19861a99025b311ef,68da9a248de3c1d595cb5dd2,false,false,Mon Sep 29 2025 14:39:32 GMT+0000 (Coordinated Universal Time),Sun Nov 23 2025 22:33:35 GMT+0000 (Coordinated Universal Time),Sun Nov 23 2025 22:34:12 GMT+0000 (Coordinated Universal Time),https://www.solarpunksangha.com/academy/meta-narratives/the-necrocene,"<p id="""">""Our sophisticated systems help us precisely target terrorists while minimizing collateral damage.""</p>","""Our sophisticated systems help us precisely target terrorists while minimizing collateral damage.""",12,https://cdn.prod.website-files.com/64a6e8d0934bf5388f56b867/68da9c74a6b40dfc6c64fe87_Technocognition.png,👨‍💻,🦠 Necrocene,Operational Mechanisms,The Digital Layer: Using technology to shape thought and behavior at scale.,Captures attention and data to manipulate behavior—hoarding technological sovereignty and cognitive autonomy.,Surveillance State,Hidden observational control,Automated Extraction,Machines mining value from life,Attention Algorithm,Manufacturing addiction for profit,Techno-Utopia Escapism,"Abandon Earth, no fix!","<p id="""">Do the tools of the <strong>Surveillance State</strong> and <strong>Automated Extraction</strong> feel like an inevitable price for connection, or am I actively practicing <strong>Techno-Utopia Escapism</strong> to avoid confronting their corrosive effects on my <strong>Attention Algorithm</strong> and autonomy?</p>","<p id="""">1. Does technology increase surveillance and control?</p><p id="""">2. Are algorithms designed to manipulate behavior?</p><p id="""">3. Is tech innovation focused on escapism over solution-making?</p>","<p id="""">- Screen time and addiction rates</p><p id="""">- Data privacy breaches</p><p id="""">- Tech solutionism vs. real-world impact</p>","<p id=""""><strong id="""">The Eyes</strong></p><p id="""">Capacity for Attention &amp; Perception</p>",<p>To control the narrative through high-tech surveillance and information warfare.</p>,<p>AI targeting systems; social media manipulation; killing journalists; controlling internet access.</p>,"<p><strong id="""">Convenience &amp; Connection</strong>: Framing digital control as necessary for security.</p>",Using technology to shape thought and behavior at scale,"<ul id=""""><li id=""""><strong id="""">Object of Perception:</strong> Human Attention</li><li id=""""><strong id="""">ENHANCES:</strong> Behavioral manipulation; data extraction; personalized control; scale of influence</li><li id=""""><strong id="""">OBSOLESCES:</strong> Privacy; autonomy; deep focus; independent judgment</li><li id=""""><strong id="""">RETRIEVES:</strong> Village gossip and social surveillance at planetary scale</li><li id=""""><strong id="""">REVERSES INTO:</strong> Cognitive fragmentation, attention deficit, and epistemic chaos</li></ul>","<p id=""""><strong>Cognitive Parasites:</strong> Technology is deployed to extract attention, data, and energy, creating addiction and escapism while avoiding real problems.</p>","<p id="""">TikTok Algorithm and Attention Extraction (2016-present)</p><p id="""">TikTok's ""For You"" page algorithm demonstrates technocognition through surveillance state data collection, automated extraction of attention and behavioral data, algorithmic manipulation of consciousness, and techno-utopian promises of creative expression masking exploitation.</p><p id=""""><em id="""">Sources: </em><a href=""https://www.technologyreview.com/2021/03/04/1020346/tiktok-read-private-messages-android-iphone-users-privacy/"" target=""_blank"" id="""">MIT Technology Review Analysis</a> | <a href=""https://www.law.georgetown.edu/privacy-technology-center/publications/"" target=""_blank"" id="""">Georgetown Law Privacy Report</a> | <a href=""https://www.pewresearch.org/internet/fact-sheet/social-media/"" target=""_blank"">Pew Research Social Media Study</a></p>","<p id=""""><strong>""The Age of Surveillance Capitalism""</strong> by Shoshana Zuboff (2019)</p><p id="""">Zuboff's comprehensive analysis of how technology companies extract behavioral data for profit, creating new forms of surveillance and control while promising technological liberation.</p>",,,,Raja
Instruments (Necrocene),12t,68d43be19861a99025b311ef,68da9a24c9942d7f7af351f5,false,false,Mon Sep 29 2025 14:39:32 GMT+0000 (Coordinated Universal Time),Sun Nov 23 2025 22:33:34 GMT+0000 (Coordinated Universal Time),Sun Nov 23 2025 22:34:12 GMT+0000 (Coordinated Universal Time),https://www.solarpunksangha.com/academy/meta-narratives/the-necrocene,"<p id="""">""We offered them elections and statehood, they chose violence instead.""</p>","""We offered them elections and statehood, they chose violence instead.""",13,https://cdn.prod.website-files.com/64a6e8d0934bf5388f56b867/68da9c993a4a8610b5021613_Instruments%20(N).png,📱,🦠 Necrocene,Measured Outcomes,The Control Tools: Seemingly neutral systems that enforce power imbalances.,Designs participation as performance—hoarding real decision-making behind hollow rituals like voting or surveys.,Voting,Controlled participation,Money,Abstracted control,Education,Ideological indoctrination,Biopower,Control over life itself,"<p id="""">When I use the primary Instruments of change—like <strong>Voting</strong> or <strong>Money</strong>—am I genuinely exerting influence, or am I mostly managing my compliance within a system of <strong>Biopower</strong> that governs life itself?</p>","<p id="""">1. Do instruments of participation (e.g., voting) lead to real change?</p><p id="""">2. Is education geared toward critical thinking or indoctrination?</p><p id="""">3. Does biopower manage populations rather than enhance life?</p>","<p id="""">- Voter turnout and efficacy</p><p id="""">- Educational outcomes vs. employment</p><p id="""">- Biometric surveillance coverage</p>","<p id=""""><strong id="""">The Voice Box</strong></p><p id="""">Capacity for Political Will</p>",<p>To render Palestinian political voice meaningless while maintaining democratic appearances.</p>,<p>Allowing symbolic elections while ensuring they cannot change material conditions or achieve sovereignty.</p>,"<p><strong id="""">Civic Duty</strong>: Framing participation in broken systems as ""political maturity.""</p>",Seemingly neutral systems that enforce power imbalances,"<ul id=""""><li id=""""><strong id="""">Object of Perception:</strong> Participation / Agency</li><li id=""""><strong id="""">ENHANCES:</strong> Illusion of participation; measurable compliance; bureaucratic management</li><li id=""""><strong id="""">OBSOLESCES:</strong> Actual agency; substantive democracy; critical consciousness</li><li id=""""><strong id="""">RETRIEVES:</strong> Rituals of allegiance and feudal homage in modern bureaucratic forms</li><li id=""""><strong id="""">REVERSES INTO:</strong> Instruments of change become tools for managing consent to one's own domination</li></ul>","<p>Tools of Oppression: Instruments like voting, money, education, and biopower are corrupted to measure and enforce compliance rather than empowerment.</p>","<p id="""">Standardized Testing in Public Education (1990s-present)</p><p id="""">The proliferation of high-stakes testing demonstrates how educational instruments operate as biopower, sorting populations, disciplining both students and teachers, while creating market opportunities for testing companies.</p><p id=""""><em id="""">Sources: </em><a href=""https://www.ets.org/research/"" target=""_blank"" id="""">Educational Testing Service Research</a> | <a href=""https://nepc.colorado.edu/topics/assessment"" target=""_blank"" id="""">National Education Policy Center</a> | <a href=""https://www.brookings.edu/topic/education/"" target=""_blank"">Brookings Institution Education Analysis</a></p>","<p id=""""><strong>""Discipline and Punish""</strong> by Michel Foucault (1975)</p><p id="""">Foucault's analysis of how institutions shape subjects through disciplinary power, revealing how voting, education, and other instruments function as forms of biopower that create docile bodies.</p>",civil-society,safety-security,,Raja
Measurements (Necrocene),13t,68d43be19861a99025b311ef,68da9a24469351354eb7b982,false,false,Mon Sep 29 2025 14:39:32 GMT+0000 (Coordinated Universal Time),Sun Nov 23 2025 22:33:34 GMT+0000 (Coordinated Universal Time),Sun Nov 23 2025 22:34:12 GMT+0000 (Coordinated Universal Time),https://www.solarpunksangha.com/academy/meta-narratives/the-necrocene,"<p id="""">""Our precision strikes have an unprecedented terrorist-to-civilian ratio.""</p>","""Our precision strikes have an unprecedented terrorist-to-civilian ratio.""",14,https://cdn.prod.website-files.com/64a6e8d0934bf5388f56b867/68da9cc520aed130db0bed51_Measurements%20(N).png,🗳️,🦠 Necrocene,Measured Outcomes,"The Validation Metrics: Quantifying the system's ""success"" on its own terms.",Quantifies only what serves extraction—hoarding legitimacy through metrics like GDP that hide harm.,Engagement,Managed participation,Material Benefits,Accumulation metrics,Assimilation,Cultural homogenization,Belief,Ideological compliance,"<p id="""">Why do we measure success through metrics like <strong>Engagement</strong> and <strong>Material Benefits</strong>, and what does this focus cause us to overlook or sacrifice in terms of well-being, meaning, and authentic <strong>Belief</strong>? &nbsp; &nbsp;</p>","<p id="""">1. Are metrics gamed to show false success?</p><p id="""">2. Do measurements reflect well-being or mere activity?</p><p id="""">3. Is assimilation forced rather than voluntary?</p>","<p id="""">- GDP vs. genuine progress indicator</p><p id="""">- Social mobility statistics</p><p id="""">- Cultural assimilation rates</p>","<p id=""""><strong id="""">The Mirror</strong></p><p id="""">Capacity for Self-Awarenes</p>",<p>To validate the operation using metrics that obscure the humanitarian catastrophe.</p>,"<p>Counting ""terrorists killed"" while ignoring civilian deaths; measuring ""restraint"" by bombs not dropped.</p>","<p><strong id="""">Quantitative Rigor</strong>: Hiding ethical bankruptcy behind body counts and military metrics.</p>","Quantifying the system's ""success"" on its own terms","<ul id=""""><li id=""""><strong id="""">Object of Perception:</strong> Success / Value</li><li id=""""><strong id="""">ENHANCES:</strong> Quantifiable outputs; gaming of metrics; illusion of progress</li><li id=""""><strong id="""">OBSOLESCES:</strong> Qualitative experience; well-being; ecological health; meaningful goals</li><li id=""""><strong id="""">RETRIEVES:</strong> Pharaonic tomb-building mentality where monuments matter more than people</li><li id=""""><strong id="""">REVERSES INTO:</strong> Metrics become completely detached from reality they purport to measure</li></ul><p id=""""></p>","<p>Vanity Metrics: Outcomes like engagement, material benefits, assimilation, and belief are tracked to validate system performance while masking dysfunction.</p>","<p id="""">Social Media Engagement Metrics (2004-present)</p><p id="""">The development of likes, shares, comments, and engagement rates as primary measurements demonstrates how platforms reduce human interaction to quantified engagement, driving behavioral modification and belief formation through algorithmic feedback loops.</p><p id=""""><em id="""">Sources: </em><a href=""https://www.oii.ox.ac.uk/research/projects/"" target=""_blank"" id="""">Oxford Internet Institute</a> | <a href=""https://www.humanetech.com/research"" target=""_blank"" id="""">Center for Humane Technology</a> | <a href=""https://datasociety.net/research/"" target=""_blank"">Data &amp; Society Research Institute</a></p>","<p id=""""><strong>""The Tyranny of Metrics""</strong> by Jerry Muller (2018)</p><p id="""">Muller's critique of how quantification and measurement systems distort human behavior and social institutions, forcing complex realities into simplified metrics that serve power rather than truth.</p>",research-based-institutions,citizenship-advocacy,,Raja
Psychic Schema (Necrocene),14t,68d43be19861a99025b311ef,68da9a2427eccfdb5ff510e5,false,false,Mon Sep 29 2025 14:39:32 GMT+0000 (Coordinated Universal Time),Sun Nov 23 2025 22:33:34 GMT+0000 (Coordinated Universal Time),Sun Nov 23 2025 22:34:12 GMT+0000 (Coordinated Universal Time),https://www.solarpunksangha.com/academy/meta-narratives/the-necrocene,"<p id="""">""Their culture glorifies martyrdom, we're fighting an ideology, not a people.""</p>","""Their culture glorifies martyrdom, we're fighting an ideology, not a people.""",15,https://cdn.prod.website-files.com/64a6e8d0934bf5388f56b867/68da9cdf1ee4de633aa2fbe7_Psychic%20Schema%20(N).png,🤖,🦠 Necrocene,Measured Outcomes,The Inner Landscape: Psychological and spiritual effects of the system.,Colonizes the inner world with nihilism and consumerism—hoarding meaning by destroying sacred connection.,Nihilism,"Nothing matters, so consume",Consumerist Salvation,Buy things to fill void,Influencer Worship,Celebrity parasocial relationships,Disenchantment,World stripped of the sacred,"<p id="""">When I feel the pull of <strong id="""">Nihilism</strong> or the promise of <strong id="""">Consumerist Salvation</strong>, am I responding to a genuine human need, or to a Psychic Schema engineered by a culture of <strong id="""">Influencer Worship</strong> that profits from my <strong>Disenchantment</strong>?</p>","<p id="""">1. Is there widespread apathy or despair?</p><p id="""">2. Are meaning substitutes (shopping, fame) promoted?</p><p id="""">3. Is the world viewed as disenchanted and mechanical?</p>","<p id="""">- Mental health prevalence</p><p id="""">- Consumer confidence indexes</p><p id="""">- Participation in community or spiritual activities</p>","<p id=""""><strong id="""">The Pineal Gland</strong></p><p id="""">Capacity for Meaning &amp; Enchantment</p>",<p>To destroy Their cultural and spiritual identity.</p>,"<p>Targeting universities, libraries, archaeological sites, and religious landmarks.</p>","<p><strong id="""">Irony and Cynicism</strong>: Framing cultural destruction as ""collateral damage"" in necessary war.</p>",Psychological and spiritual effects of the system,"<ul id=""""><li id=""""><strong id="""">Object of Perception:</strong> Meaning / Purpose</li><li id=""""><strong id="""">ENHANCES:</strong> Nihilism; consumerist coping; celebrity worship; disenchantment</li><li id=""""><strong id="""">OBSOLESCES:</strong> Authentic meaning; spiritual connection; community purpose; wonder</li><li id=""""><strong id="""">RETRIEVES:</strong> Ancient stoicism and cynicism, but stripped of their philosophical depth</li><li id=""""><strong id="""">REVERSES INTO:</strong> Spiritual hunger becomes so acute it manifests as addiction, fundamentalism, or mental health crisis</li></ul>","<p>Soul Sickness: Collective psyche exhibits nihilism, consumerist salvation, influencer worship, and disenchantment—a loss of meaning and connection.</p>","<p id="""">Instagram Influencer Economy (2010-present)</p><p id="""">The rise of influencer culture demonstrates the psychic schema of late capitalism: nihilistic acceptance of commodified authenticity, consumerist salvation through product consumption, worship of lifestyle influencers as secular saints, and the disenchantment of genuine human connection through algorithmic mediation.</p><p id=""""><em id="""">Sources: </em><a href=""https://www.socialmediaexaminer.com/social-media-marketing-industry-report/"" target=""_blank"" id="""">Social Media Examiner Industry Report</a> | <a href=""https://influencermarketinghub.com/influencer-marketing-statistics/"" target=""_blank"" id="""">Influencer Marketing Hub Statistics</a> | <a href=""https://www.stern.nyu.edu/"" target=""_blank"">NYU Stern Business School Analysis</a></p>","<p id=""""><strong>""Capitalist Realism""</strong> by Mark Fisher (2009)</p><p id="""">Fisher's analysis of how capitalism has colonized desire and the unconscious, creating nihilistic acceptance of ""there is no alternative"" while offering consumerist salvation and celebrity worship as substitutes for authentic meaning.</p>",civil-society,social-spirituality,,Bhakti
Conscious Realism,15t,68d43be19861a99025b311ef,68da9a247a38705ff13e9fe3,false,false,Mon Sep 29 2025 14:39:32 GMT+0000 (Coordinated Universal Time),Sun Nov 23 2025 22:33:35 GMT+0000 (Coordinated Universal Time),Sun Nov 23 2025 22:34:12 GMT+0000 (Coordinated Universal Time),https://www.solarpunksangha.com/academy/meta-narratives/sustainable-future,"<p id=""""><em id="""">""The Self is everywhere. Whoever sees all beings in the Self, and the Self in all beings, hates no one.""</em> — <strong id="""">Isha Upanishad 6</strong></p>","""The Self is everywhere. Whoever sees all beings in the Self, and the Self in all beings, hates no one."" — Isha Upanishad 6",17,https://cdn.prod.website-files.com/64a6e8d0934bf5388f56b867/68da9cf3351f7933d803179b_Conscious%20Realism.avif,✴️,✴️ Symbiotic Commonwealth,Metaphysical Ground,"The Living Universe: The foundational recognition that consciousness is fundamental to reality, making the universe inherently meaningful, relational, and alive.","Recognizes consciousness as primary, making all beings subjects with intrinsic worth—dissolving the logic of possession and control.",Participatory Cosmopolitics,Governance as co-creative dialogue with a conscious world,Value Actualization,Economics as the art of nurturing latent potentials in a living system,Meaning-making Culture,Human expression as the universe's way of understanding itself,Sentient Nature,"Environment as a community of subjects, not a collection of objects","<p id="""">How might I reorganize my <strong>life</strong>—my <strong>work</strong>, my <strong>relationships</strong>, my <strong>consumption</strong>—to participate in a living universe where my choices regenerate rather than deplete, making me a conduit for ecological and social healing?</p>","<p id="""">1. Does the system honor interiority as well as exteriority?</p><p id="""">2. Are relationships valued as fundamental rather than derivative?</p><p id="""">3. Does decision-making account for the experience of all beings?</p>","<p id="""">- Measures of ecological consciousness</p><p id="""">- Cultural indicators of meaning and purpose</p><p id="""">- Policies recognizing rights of nature</p>","<p id=""""><strong id="""">The Awakened Heart</strong> </p><p id="""">Capacity for Perceiving Unity</p>","<p>To ground action in the truth of interconnection, making care the most rational response.</p>","<p>Contemplative practice, deep ecology, and sciences that honor interiority.</p>","<p><strong id="""">Anekāntavāda (The Principle of Multiple Perspectives):</strong> Actively resisting the single, reductionist story by honoring the manifold nature of truth.</p>",The foundational recognition that consciousness is fundamental to reality,"<ul id=""""><li id=""""><strong id="""">Object of Perception:</strong> Reality / The Universe</li><li id=""""><strong id="""">ENHANCES:</strong> Sense of participation and relationship; intrinsic meaning; ethical foundation based on care</li><li id=""""><strong id="""">OBSOLESCES:</strong> Subject-object dichotomy; human separateness; nature as ""dead"" resource</li><li id=""""><strong id="""">RETRIEVES:</strong> Animistic and indigenous worldviews through modern philosophical/scientific synthesis</li><li id=""""><strong id="""">REVERSES INTO:</strong> Profound embodiment where the ""sacred"" manifests in every action and relationship</li></ul><p id=""""></p>","<p id=""""><strong>Metaphysical Intimacy</strong> - The universe is a field of consciousness seeking relationship, making care the rational response.</p>","<p id="""">Ecuador's Rights of Nature </p><p id="""">Constitutional recognition that ecosystems have inherent rights to exist and flourish. A real-world legal and political enactment of a consciousness-centric view. By granting ecosystems inherent rights to exist and flourish, it fundamentally challenges the Necrocene premise of nature as a dead resource. It demonstrates how a shift in foundational story changes governance</p>","<p id=""""><strong>""The Idea of the World""</strong> by Bernardo Kastrup (2019)</p><p id="""">Offers a rigorous defense of idealism. Kastrup argues consciousness is fundamental, and the material world is its manifestation. This provides the scientific and philosophical foundation for a reality based on relationship, meaning, and intrinsic value, countering Dennett's perspective.</p>",civil-society,social-spirituality,,Jnana
