Theory,Slug,Collection ID,Item ID,Archived,Draft,Created On,Updated On,Published On,Breadcrumb Link,Quote,Block Quote,Sort Order,Emoji,Text Emoji,Meta-Narrative,Logic,Short Description,Power Dynamic,Politics Theory,Political Theory Description,Economics theory,Economics short description,Culture theory,Culture short description,Ecology theory,Ecology short description,💡 Self enquiry,Diagnosis questions,Related variables,Organ,Rationale,Extraction/Cultivation,Defense/Propagation,🩻 Tetrad Central Claim,🩻 Tetrad Analysis,Partial diagnosis,🎓 Case Study,📚 Literature RTF,🔮 Research Circles,🧊 Life Course,🪪 Universal Human Rights,Four Yogas
Structural Violence,4t,68d43be19861a99025b311ef,68da9a23da8d5af9e99cf218,false,false,Mon Sep 29 2025 14:39:31 GMT+0000 (Coordinated Universal Time),Sun Nov 23 2025 22:33:34 GMT+0000 (Coordinated Universal Time),Sun Nov 23 2025 22:34:12 GMT+0000 (Coordinated Universal Time),https://www.solarpunksangha.com/academy/meta-narratives/the-necrocene,"<p id="""">""These people have always been divided, we're just managing the situation (mowing the grass).""</p>","""These people have always been divided, we're just managing the situation (mowing the grass).""",5,https://cdn.prod.website-files.com/64a6e8d0934bf5388f56b867/68da9bf70e47d95d2a38c991_Structural%20Violence.avif,⚔️,🦠 Necrocene,Foundational Logic,"The Daemonic Nature:  Violence is not an aberration but the primary operating system - the invisible energy source powering extraction, domination, and control.","Designs systems where some lives are disposable—hoarding safety, health, and dignity for the few by sacrificing the many.",Necroviolence,The desecration of humanity,Prolonged Violence,"Structural deprivation that kills gradually through poverty, pollution, precarious work",Epistemic Violence,"Destruction of meaning systems, languages, and cultural memory",Ecological Violence,"Treating living systems as disposable, creating sacrifice zones",<p>In what ways do my daily choices depend on or ignore systems of violence I don't have to see?</p>,"<p id="""">1. Does the system require some beings to suffer for others to flourish?</p><p id="""">2. Is harm externalized to invisible populations or future generations?</p><p id="""">3. Are there sacrificial logics built into economic and political calculations?</p>","<p id="""">-Direct and indirect mortality rates from systemic causes</p><p id="""">-Wealth transfer from vulnerable to powerful</p><p id="""">-Ecological damage costs vs. prevention costs</p>","<p id=""""><strong id="""">The Lungs</strong></p><p id="""">Capacity for Collective Solidarity</p>",<p>To create a permanent crisis economy where destruction becomes profitable.</p>,"<p>Targeting family homes, community centers, mosques, and schools, the infrastructure of social reproduction.</p>","<p><strong id="""">Naturalization</strong>: Framing fragmentation as ancient ""tribal conflicts"" rather than engineered policy.</p>",Violence as the primary operating system for extraction and control,"<ul id=""""><li id=""""><strong id="""">Object of Perception:</strong> Social Order</li><li id=""""><strong id="""">ENHANCES:</strong> Social control through fear; efficiency of domination; externalization of costs</li><li id=""""><strong id="""">OBSOLESCES:</strong> Empathy; solidarity; restorative justice; visible accountability</li><li id=""""><strong id="""">RETRIEVES:</strong> Colonial and feudal power relations, sanitized through bureaucracy</li><li id=""""><strong id="""">REVERSES INTO:</strong> Pervasive insecurity and paranoia that ultimately threatens the powerful; normalized pathology becomes visible as systemic collapses</li></ul><p id=""""></p>","<p id=""""><strong>Normalized Pathological Violence</strong> - Harm is so embedded it becomes invisible, treated as ""the way things are""</p>","<p id="""">The Prison-Industrial Complex </p><p id="""">Direct physical violence as economic engine and social control.</p>","<p id=""""><strong>""The Land of Open Graves: Living and Dying on the Migrant Trail""</strong> by Jason De León (2015)</p><p id="""">The author, an anthropologist, coined the term ""necroviolence"" and his work provides a forensic and ethnographic analysis of how state policies constitute a form of structural violence that continues to exert force on the bodies of migrants even after death.</p>",civil-society,safety-security,,Karma
Besieged Ethos,5t,68d43be19861a99025b311ef,68da9a2352cd8ec7df1466e7,false,false,Mon Sep 29 2025 14:39:31 GMT+0000 (Coordinated Universal Time),Sun Nov 23 2025 22:33:34 GMT+0000 (Coordinated Universal Time),Sun Nov 23 2025 22:34:12 GMT+0000 (Coordinated Universal Time),https://www.solarpunksangha.com/academy/meta-narratives/the-necrocene,"<p id="""">""Our hands are tied, we must elect strong leaders to deal with their constant threats.""</p>","""Our hands are tied, we must elect strong leaders to deal with their constant threats.""",6,https://cdn.prod.website-files.com/64a6e8d0934bf5388f56b867/68da9b851ee4de633aa2806c_Besieged%20Ethos.png,🧌,🦠 Necrocene,Systemic Expressions,The Pathological Core: Social Darwinism rewarding antisocial personality traits.,"Cultivates narcissistic, paranoid leadership that hoards decision-making power by manufacturing perpetual crisis.",Narcissism,Grandiose self-regard,Machiavellianism,Cunning exploitation,Psychopathy,Lack of empathy,Sadism,Pleasure in destruction,"<p id="""">How are traits like <strong>Machiavellianism</strong> and strategic <strong>Narcissism</strong> not just rewarded but often required for ""success"" within dominant institutions, and what is the psychic cost of adopting this ethos?</p>","<p id="""">1. Are empathy and cooperation penalized?</p><p id="""">2. Is manipulation rewarded as ""smart strategy""?</p><p id="""">3. Do leaders exhibit pathological traits?</p>","<p id="""">- Rates of mental health issues</p><p id="""">- Corporate ethics violations</p><p id="""">- Social trust indices</p>","<p id=""""><strong id="""">Prefrontal Cortex</strong></p><p id="""">Capacity for Empathy &amp; Foresight</p>",<p>To cultivate political leadership that sees permanent war as natural and necessary.</p>,"<p>Rewarding maximalist politicians; purging moderate voices; creating permanent ""emergency"" governance.</p>","<p><strong id="""">Meritocracy Myth</strong>: Framing hardline positions as ""tough realism"" versus ""naive idealism.""</p>",Social Darwinism rewarding antisocial personality traits,"<ul id=""""><li id=""""><strong id="""">Object of Perception:</strong> Success / Leadership</li><li id=""""><strong id="""">ENHANCES:</strong> Short-term competitive advantage; ruthless efficiency in extraction; manipulation skills</li><li id=""""><strong id="""">OBSOLESCES:</strong> Empathy; cooperation; ethical constraints; long-term trust building</li><li id=""""><strong id="""">RETRIEVES:</strong> Machiavellian prince and robber baron as cultural ideals</li><li id=""""><strong id="""">REVERSES INTO:</strong> Pervasive distrust makes collaboration impossible; organizational psychopathy destroys institutional knowledge and resilience</li></ul><p id=""""></p>","<p id=""""><strong>Character Cancer</strong>: System selects for and amplifies pathological personality traits (narcissism, psychopathy) as adaptive, eroding ethical foundations.</p>","<p id="""">Theranos and Elizabeth Holmes (2003-2022)</p><p id="""">The rise and fall of Theranos demonstrates how narcissistic leadership, Machiavellian manipulation, psychopathic disregard for consequences, and sadistic treatment of whistleblowers created a corporate culture that embodied the besieged ethos while promising healthcare innovation.</p><p id=""""><em id="""">Sources: </em><a href=""https://ideas.darden.virginia.edu/theranos-darden-case"" target=""_blank"" id="""">UVA Darden Case Study</a> | <a href=""https://scholarworks.uark.edu/finnuht/72/"" target=""_blank"" id="""">University of Arkansas Analysis</a> | <a href=""https://www.sec.gov/news/press-release/2018-41"" target=""_blank"" id="""">SEC Fraud Charges</a></p>","<p id=""""><strong>""The Psychopath Test""</strong> by Jon Ronson (2011)</p><p id="""">Ronson's investigation into psychopathy in corporate and political leadership reveals how the ""dark tetrad"" personality traits are not aberrations but systematic features of power structures under late capitalism.</p>",civil-society,daily-life-employment,,Bhakti
Domestication,6t,68d43be19861a99025b311ef,68da9a2336e323ee3bda2cf6,false,false,Mon Sep 29 2025 14:39:31 GMT+0000 (Coordinated Universal Time),Sun Nov 23 2025 22:33:34 GMT+0000 (Coordinated Universal Time),Sun Nov 23 2025 22:34:12 GMT+0000 (Coordinated Universal Time),https://www.solarpunksangha.com/academy/meta-narratives/the-necrocene,"<p id="""">""We provide their electricity and water, this is how they repay our generosity.""</p>","""We provide their electricity and water, this is how they repay our generosity.""",7,https://cdn.prod.website-files.com/64a6e8d0934bf5388f56b867/68da9bfec142b264491a0005_Domestication.avif,🧟‍♂️,🦠 Necrocene,Systemic Expressions,"The Taming Process: Reducing vibrant life to controllable, exploitable units.","Engineers dependence by stripping autonomy—hoarding control over water, energy, food, and movement to create compliance.",State of Exception,Suspension of rights,Commodum,Everything as commodity,Homo Sacer,Sacred man made killable,Bare Life,Reduction to biological minimum,"<p id="""">Who are the modern <strong>Homo Sacer</strong>—people reduced to <strong>Bare Life</strong>—in our society, and what <strong>State of Exception</strong> has been invoked to make their exclusion seem like a necessary <strong>Commodum</strong> (convenience/benefit) for the rest of us?</p>","<p id="""">1. Does the system discourage self-reliance?</p><p id="""">2. Are people dependent on institutions for basic needs?</p><p id="""">3. Is dissent pathologized or criminalized?</p>","<p id="""">- Levels of public participation</p><p id="""">- Access to essential services</p><p id="""">- Crime rates vs. poverty rates</p>","<p id=""""><strong id="""">The Spine</strong></p><p id="""">Capacity for Sovereignty &amp; Agency</p>",<p>To engineer total dependence on Occupation-controlled systems for survival.</p>,"<p>Controlling all borders, water, electricity, food imports, communications, and movement.</p>","<p id=""""><strong id="""">Pathologizing Dissent</strong>: Framing resistance as ""ingratitude"" for Zionist ""humanitarian coordination.""</p>","Reducing vibrant life to controllable, exploitable units","<ul id=""""><li id=""""><strong id="""">Object of Perception:</strong> Human Potential</li><li id=""""><strong id="""">ENHANCES:</strong> Predictability; manageability; compliance; consumption patterns</li><li id=""""><strong id="""">OBSOLESCES:</strong> Autonomy; self-reliance; critical thinking; wildness</li><li id=""""><strong id="""">RETRIEVES:</strong> Feudal dependence relationships through modern corporate and state structures</li><li id=""""><strong id="""">REVERSES INTO:</strong> Learned helplessness creates fragile, dependent populations unable to solve novel problems</li></ul><p id=""""></p>","<p id=""""><strong>Engineered Helplessness</strong>: System designs dependence on institutional structures that harm, reducing agency and fostering submission.</p>","<p id="""">Immigration Detention Centers (1990s-present)</p><p id="""">Modern detention facilities (Alligator Alcatraz) represent spaces of exception where migrants exist as homo sacer - neither fully human subjects with rights nor completely outside the law, but suspended in a zone where normal legal protections don't apply.</p><p id=""""><em id="""">Sources: </em><a href=""https://www.aclu.org/issues/immigrants-rights/immigrants-rights-and-detention"" target=""_blank"" id="""">ACLU Detention Report</a> | <a href=""https://www.dhs.gov/immigration-statistics"" target=""_blank"" id="""">DHS Immigration Statistics</a> | Agamben, G. ""Homo Sacer"" (Stanford University Press, 1998)</p><p id="""">‍</p>","<p id=""""><strong>""Homo Sacer: Sovereign Power and Bare Life""</strong> by Giorgio Agamben (1998)</p><p id="""">Agamben's exploration of how sovereign power creates zones of exception where subjects are reduced to ""bare life"" - included in the political order only through their exclusion, making them killable but not sacrificeable.</p>",business-organizations,daily-life-employment,,Raja
Antidiologic,7t,68d43be19861a99025b311ef,68da9a24cdf266069e8093e3,false,false,Mon Sep 29 2025 14:39:32 GMT+0000 (Coordinated Universal Time),Sun Nov 23 2025 22:33:36 GMT+0000 (Coordinated Universal Time),Sun Nov 23 2025 22:34:12 GMT+0000 (Coordinated Universal Time),https://www.solarpunksangha.com/academy/meta-narratives/the-necrocene,"<p id="""">""We have no one to talk to, they can't even agree among themselves.""</p>","""We have no one to talk to, they can't even agree among themselves.""",8,https://cdn.prod.website-files.com/64a6e8d0934bf5388f56b867/68da9c08b2b0f06e3f82ebaa_Antidiologic.png,🙅‍♂️,🦠 Necrocene,Systemic Expressions,The Anti-Solidarity Framework: Actively preventing collective consciousness.,Fragments solidarity to prevent collective power—hoarding narrative coherence by dividing movements and cultures.,Conquest,Domination over others,Divide & Conquer,Fragmenting solidarity,Cultural Invasion,Imposing worldview,Manipulation,Controlling natural systems,"<p id="""">Where do I see the Antidiologic of <strong>Divide &amp; Conquer</strong> being used to turn potential allies against each other, preventing solidarity through <strong>Cultural Invasion</strong> that promotes individualism over collective action?</p>","<p id="""">1. Are social bonds fragmented by design?</p><p id="""">2. Does the system pit groups against each other?</p><p id="""">3. Is cultural diversity replaced by homogenized consumerism?</p>","<p id="""">- Social cohesion metrics</p><p id="""">- Income inequality Gini coefficient</p><p id="""">- Diversity of media ownership</p>","<p id=""""><strong id="""">The Vocal Cords</strong></p><p id="""">Capacity for Authentic Dialogue</p>",<p>To prevent Their narrative coherence and international solidarity.</p>,<p>Fragmenting Their political representation; banning Their civil society organizations; digital censorship.</p>,"<p><strong id="""">Divide et Impera</strong>: Encouraging internal divisions while claiming to seek ""partners for peace.""</p>",Actively preventing collective consciousness,"<ul id=""""><li id=""""><strong id="""">Object of Perception:</strong> Social Relationships</li><li id=""""><strong id="""">ENHANCES:</strong> Social fragmentation; individual isolation; manufactured consent</li><li id=""""><strong id="""">OBSOLESCES:</strong> Solidarity; collective intelligence; mutual aid; critical dialogue</li><li id=""""><strong id="""">RETRIEVES:</strong> Tribal divisions and prejudices, amplified by algorithmic media</li><li id=""""><strong id="""">REVERSES INTO:</strong> Isolated individuals become susceptible to mass movements and authoritarian solutions</li></ul><p id=""""></p>","<p id=""""><strong>Social Autoimmunity</strong>: System attacks the immune system of community solidarity through division, conquest, and cultural invasion.</p>","<p id="""">Facebook's ""Free Basics"" Program in India (2013-2016)</p><p id="""">Meta's attempt to provide ""free"" internet access through a curated platform exemplified antidialogical cultural invasion - offering technological conquest disguised as benevolence while dividing communities and manipulating information access.</p><p id=""""><em id="""">Sources: </em><a href=""https://cis-india.org/internet-governance/blog/the-cost-of-free-basics-in-india"" target=""_blank"" id="""">Centre for Internet and Society</a> | <a href=""https://www.researchgate.net/publication/327882672_The_Privatization_of_Internet_Governance_Facebook_Free_Basics_in_India"" target=""_blank"" id="""">ResearchGate Academic Analysis</a> | <a href=""https://store.hbr.org/product/facebook-s-free-basics-free-in-india/W16544"" target=""_blank"">Harvard Business Review Case</a></p>","<p id=""""><strong>""Pedagogy of the Oppressed""</strong> by Paulo Freire (1970)</p><p id="""">Freire's analysis of antidialogical action reveals how oppressive systems use conquest, divide and conquer tactics, cultural invasion, and manipulation to maintain power while preventing authentic dialogue and critical consciousness. <a href=""https://www.solarpunksangha.com/academy/modules/pedagogy-of-the-oppressed"">View our Module</a> on this book.</p>",research-based-institutions,social-spirituality,,Jnana
Complexity,8t,68d43be19861a99025b311ef,68da9a241998812a680ee802,false,false,Mon Sep 29 2025 14:39:32 GMT+0000 (Coordinated Universal Time),Sun Nov 23 2025 22:33:34 GMT+0000 (Coordinated Universal Time),Sun Nov 23 2025 22:34:12 GMT+0000 (Coordinated Universal Time),https://www.solarpunksangha.com/academy/meta-narratives/the-necrocene,"<p id="""">""Their infrastructure is used for terrorism, we have no choice but to target it.""</p>","""Their infrastructure is used for terrorism, we have no choice but to target it.""",9,https://cdn.prod.website-files.com/64a6e8d0934bf5388f56b867/68da9c1f9273a28c67015691_Complexity.png,🏚️,🦠 Necrocene,Systemic Expressions,Engineered Collapse: Creating systems too complex and fragile to withstand shocks.,"Centralizes control under the guise of efficiency—hoarding system intelligence in opaque, fragile hierarchies.",Brittle Centralization,Single point of failure systems,Supply Chain Fragility,"Globally efficient, locally catastrophic networks",Epistemic Chaos,"No shared reality, only deception",Monoculture,Kills diversity for control,"<p id="""">How does the <strong>Brittle Centralization </strong>of our global systems (food, energy, information) create a pervasive sense of vulnerability, and how does <strong>Epistemic Chaos</strong> (flood of misinformation) prevent us from building a coherent response?</p>","<p id="""">1. Is the system overly centralized?</p><p id="""">2. Does it have redundant fail-safes?</p><p id="""">3. Are small disruptions capable of causing cascading failures?</p>","<p id="""">- Supply chain vulnerability indexes</p><p id="""">- System downtime costs</p><p id="""">- Innovation rate vs. stability</p>","<p id=""""><strong id="""">The Immune System</strong></p><p id="""">Capacity for Resilience</p>",<p>To ensure Their Land cannot develop autonomous systems that could withstand siege.</p>,"<p>Deliberately destroying water systems, solar panels, agricultural land, and medical infrastructure.</p>","<p><strong id="""">Technocratic Obscurantism</strong>: Framing the destruction of life-support systems as ""military necessity.""</p>",Creating systems too complex and fragile to withstand shocks,"<ul id=""""><li id=""""><strong id="""">Object of Perception:</strong> Efficiency</li><li id=""""><strong id="""">ENHANCES:</strong> Specialization; optimization under ideal conditions; global integration</li><li id=""""><strong id="""">OBSOLESCES:</strong> Redundancy; resilience; local autonomy; system-wide comprehension</li><li id=""""><strong id="""">RETRIEVES:</strong> Bureaucratic empire structures with their inherent rigidity</li><li id=""""><strong id="""">REVERSES INTO:</strong> Cascading systemic failures from minor disruptions; efficiency becomes catastrophic fragility</li></ul><p id=""""></p>","<p id=""""><strong>Efficient Fragility</strong>: System is optimized for efficiency under ideal conditions but lacks resilience, leading to collapse under stress.</p>","<p id="""">2021 Suez Canal Blockage</p><p id="""">The Ever Given container ship blocking the Suez Canal for six days demonstrated how brittle centralization and supply chain fragility can create global epistemic chaos, revealing the monoculture vulnerability of just-in-time global logistics.</p><p id=""""><em id="""">Sources: </em><a href=""https://www.sciencedirect.com/science/article/abs/pii/S0925527324003219"" target=""_blank"" id="""">ScienceDirect Supply Chain Analysis</a> | <a href=""https://porteconomicsmanagement.org/pemp/contents/part10/port-resilience/suez-canal-blockage-2021/"" target=""_blank"" id="""">Port Economics Management</a> | <a href=""https://www.researchgate.net/publication/352970560_Suez_Canal_blockage_an_analysis_of_legal_impact_risks_and_liabilities_to_the_global_supply_chain"" target=""_blank"" id="""">ResearchGate Legal Impact Study</a></p><p id="""">‍</p>","<p id=""""><strong>""The Collapse of Complex Societies""</strong> by Joseph Tainter (1988)</p><p id="""">Tainter's analysis of how increasing complexity leads to diminishing returns and eventual collapse, with brittle centralized systems becoming increasingly fragile and prone to cascade failures.</p>",governance-institutions,citizenship-advocacy,,Jnana
Finance Strategy,9t,68d43be19861a99025b311ef,68da9a24f00e0b44d729de3f,false,false,Mon Sep 29 2025 14:39:32 GMT+0000 (Coordinated Universal Time),Sun Nov 23 2025 22:33:35 GMT+0000 (Coordinated Universal Time),Sun Nov 23 2025 22:34:12 GMT+0000 (Coordinated Universal Time),https://www.solarpunksangha.com/academy/meta-narratives/the-necrocene,"<p id="""">""We can't release funds that might reach terrorist organizations.""</p>","""We can't release funds that might reach terrorist organizations.""",10,https://cdn.prod.website-files.com/64a6e8d0934bf5388f56b867/68da9c343bb60cda05e50cd3_Finance%20Strategy.png,💰,🦠 Necrocene,Operational Mechanisms,The Financial Weapon: Using money as tool for social control and extraction.,"Concentrates wealth through debt, speculation, and exclusion—hoarding capital as a weapon of social control.",Disenfranchise,Removing political power,Monopolize,Concentrating wealth,Social Dysregulation,Breaking social bonds,Dehumanization,Severing fundamental identity,"<p id="""">How does the financial system actively <strong>Disenfranchise</strong> communities while enabling capital to <strong>Monopolize</strong> essential resources, and how does this lead to the <strong>Social Dysregulation</strong> we see around us?</p>","<p id="""">1. Does finance serve speculative or extractive purposes over productive ones?</p><p id="""">2. Are monetary policies designed to concentrate wealth?</p><p id="""">3. Does debt enforce dependence?</p>","<p id="""">- Wealth distribution ratios</p><p id="""">- Access to credit metrics</p><p id="""">- Financialization of economy</p>","<p id=""""><strong id="""">The Hands</strong></p><p id="""">Capacity for creating real value</p>",<p>To prevent economic independence and maintain control through financial stranglehold.</p>,<p>Withholding Their tax revenues; destroying productive capacity; controlling all banking transactions.</p>,"<p><strong id="""">TINA</strong>: (There is no alternative) Framing the financial blockade as necessary anti-terrorism measures.</p>",Using money as tool for social control and extraction,"<ul id=""""><li id=""""><strong id="""">Object of Perception:</strong> Economic Relationships</li><li id=""""><strong id="""">ENHANCES:</strong> Capital mobility; wealth concentration; speculative profit; debt leverage</li><li id=""""><strong id="""">OBSOLESCES:</strong> Productive investment; economic democracy; community wealth; real value creation</li><li id=""""><strong id="""">RETRIEVES:</strong> Debt peonage and usury, but with global reach and sophistication</li><li id=""""><strong id="""">REVERSES INTO:</strong> Financialization detaches from real economy, creating bubbles and systemic collapse risk</li></ul><p id=""""></p>","<p id=""""><strong>Weaponized Finance</strong>: Financial systems are used to disenfranchise, monopolize, and disrupt social regulation, enforcing inequality.</p>","<p id="""">Subprime Mortgage Crisis (2007-2008)</p><p id="""">The systematic targeting of communities of color with predatory loans demonstrates how finance strategy operates through disenfranchisement (removing homeownership), monopolization (consolidating bank power), social dysregulation (destroying community wealth), and dehumanization (treating homes as abstract financial instruments).</p><p id=""""><em id="""">Sources: </em><a href=""https://fred.stlouisfed.org/series/MORTGAGE30US"" target=""_blank"" id="""">Federal Reserve Economic Data</a> | <a href=""https://www.nber.org/papers/w14135"" target=""_blank"" id="""">NBER Crisis Analysis</a> | <a href=""https://www.govinfo.gov/content/pkg/GPO-FCIC/pdf/GPO-FCIC.pdf"" target=""_blank"">Financial Crisis Inquiry Commission Report</a></p>","<p id=""""><strong id="""">""Debt: The First 5,000 Years"" </strong>by David Graeber (2011)</p><p id="""">Graeber's anthropological analysis reveals how debt functions as a tool of disenfranchisement and social control, creating conditions for monopolization and dehumanization through financial relationships.</p>",business-organizations,daily-life-employment,,Karma
