Theory,Slug,Collection ID,Item ID,Archived,Draft,Created On,Updated On,Published On,Breadcrumb Link,Quote,Block Quote,Sort Order,Emoji,Text Emoji,Meta-Narrative,Logic,Short Description,Power Dynamic,Politics Theory,Political Theory Description,Economics theory,Economics short description,Culture theory,Culture short description,Ecology theory,Ecology short description,💡 Self enquiry,Diagnosis questions,Related variables,Organ,Rationale,Extraction/Cultivation,Defense/Propagation,🩻 Tetrad Central Claim,🩻 Tetrad Analysis,Partial diagnosis,🎓 Case Study,📚 Literature RTF,🔮 Research Circles,🧊 Life Course,🪪 Universal Human Rights,Four Yogas
Extractive Temporality,15tt,68d43be19861a99025b311ef,68daaafaab9cfa0433934380,false,false,Mon Sep 29 2025 15:51:22 GMT+0000 (Coordinated Universal Time),Sun Nov 23 2025 22:33:35 GMT+0000 (Coordinated Universal Time),Sun Nov 23 2025 22:34:12 GMT+0000 (Coordinated Universal Time),https://www.solarpunksangha.com/academy/meta-narratives/the-necrocene,"<p id="""">“When peace comes we will perhaps in time be able to forgive the Arabs for killing our sons, but it will be harder for us to forgive them for having forced us to kill their sons. Peace will come when the Arabs will love their children more than they hate us.” - Golda Meir</p><p id="""">‍</p>","“When peace comes we will perhaps in time be able to forgive the Arabs for killing our sons, but it will be harder for us to forgive them for having forced us to kill their sons. Peace will come when the Arabs will love their children more than they hate us.” - Golda Meir",16,https://cdn.prod.website-files.com/64a6e8d0934bf5388f56b867/68daaa2e0f16ccc69c6fb391_Extractive%20Temporality.png,⌚,🦠 Necrocene,Measured Outcomes,"The Tyranny of the Clock: Time is linear, finite, and hostile - a resource to be exploited for immediate gain.",Sacrifices the future for present gain—hoarding short-term profit by externalizing intergenerational cost.,Short-termism,Election cycles trump generational thinking; crisis governance prevents long-term planning,Quarterly Capitalism,Future value discounted to near-zero; intergenerational theft institutionalized,Accelerated Amnesia,Cultural memory erased by novelty; trends replace traditions,Temporal Externalization,Costs pushed to future generations; slow environmental damage ignored,"<p id="""">How does my experience of time keep me trapped in emergency thinking, preventing me from acting for the long-term?</p>","<p id="""">1. Does the system sacrifice future viability for present convenience?</p><p id="""">2. Are decisions made against electoral or quarterly cycles rather than ecological or civilizational timeframes?</p><p id="""">3. Does the system accelerate itself toward collapse?</p>","<p id="""">-Discount rates used in economic planning</p><p id="""">-Intergenerational wealth/well-being transfer</p><p id="""">-Rate of cultural language/tradition loss</p>","<p id=""""><strong id="""">The Womb</strong></p><p id="""">Capacity for Intergenerational Care</p>","<p id="""">To destroy Their future-making capacity.</p>","<p>Killing children, doctors, teachers; destroying schools and pediatric hospitals; creating generational trauma.</p>","<p><strong id="""">Future Discounting</strong>: Framing the destruction of future generations as ""breaking the cycle of violence.""</p>","Time as linear, finite, and hostile - a resource to be exploited","<ul id=""""><li id=""""><strong id="""">Object of Perception:</strong> Time / The Future</li><li id=""""><strong id="""">ENHANCES:</strong> Immediate gratification; short-term thinking; crisis response</li><li id=""""><strong id="""">OBSOLESCES:</strong> Long-term planning; intergenerational responsibility; patience; cyclical wisdom</li><li id=""""><strong id="""">RETRIEVES:</strong> Apocalyptic and millennial thinking as cultural backdrop</li><li id=""""><strong id="""">REVERSES INTO:</strong> Present becomes so mortgaged to the future that both become uninhabitable; emergency thinking prevents addressing actual emergencies</li></ul>","<p><strong id="""">Temporal Bankruptcy</strong> - Stealing from the future to pay the present</p>","<p id="""">Climate Change Inaction </p><p id="""">The ultimate temporal externality.</p>","<p id=""""><strong id="""">""The Clock of the Long Now""</strong> </p><p id="""">By Stewart Brand is a book about the practical use of long time perspective: how to get it, how to use it, how to keep it in and out of sight.</p>",civil-society,daily-life-employment,,Bhakti
SolarPunk Aspirations,16t,68d43be19861a99025b311ef,68da9a2408bf19819edfc5d3,false,false,Mon Sep 29 2025 14:39:32 GMT+0000 (Coordinated Universal Time),Sun Nov 23 2025 22:33:34 GMT+0000 (Coordinated Universal Time),Sun Nov 23 2025 22:34:12 GMT+0000 (Coordinated Universal Time),https://www.solarpunksangha.com/academy/meta-narratives/sustainable-future,"<p id=""""><em id="""">""You are what your deep, driving desire is. As your desire is, so is your will. As your will is, so is your deed. As your deed is, so is your destiny.""</em> — <strong id="""">Brihadaranyaka Upanishad 4.4.5</strong></p>","""You are what your deep, driving desire is. As your desire is, so is your will. As your will is, so is your deed. As your deed is, so is your destiny."" —Brihadaranyaka Upanishad 4.4.5",19,https://cdn.prod.website-files.com/64a6e8d0934bf5388f56b867/68daab4f904ac950f3fdfe50_SolarPunk%20Aspirations.avif,🌞,✴️ Symbiotic Commonwealth,Foundational Logic,The Life-Affirming Myth: Creating societies where well-being replaces growth.,"Cultivates collective liberation through shared vision—freedom as interdependence, not escape.",Radically Democratic,Real collective self-determination,Sufficient Flourishing,Wealth that creates more life,Democracy of Meanings,Co-creation of significance,Generational Care,Seven generation stewardship,"<p id="""">What would a <strong>Radically Democratic</strong> system look like in my community, and how would practicing <strong>Generational Care</strong> shift my understanding of what constitutes <strong>Sufficient Flourishing</strong> for all?</p>","<p id="""">1. Do systems become healthier through use?</p><p id="""">2. Does participation increase collective intelligence?</p><p id="""">3. Are future generations valued in present decisions?</p>","<p id="""">- Multi-generational planning metrics</p><p id="""">- Democratic participation quality indexes</p><p id="""">- Regenerative economic indicators</p>","<p id=""""><strong id="""">The Collective Imagination</strong> </p><p id="""">Capacity for Prefigurative Vision</p>",<p>To make the desired future so compelling and tangible that it out-competes the dystopian default.</p>,"<p>Community storytelling, art, design fictions, and building functional prototypes of the future.</p>","<p><strong id="""">Desire Mapping:</strong> Cultivating shared longing for relational wealth over material accumulation.</p>",Creating societies where well-being replaces growth,"<ul id=""""><li id=""""><strong id="""">Object of Perception:</strong> Progress / The Future</li><li id=""""><strong id="""">ENHANCES:</strong> Community resilience; qualitative well-being; aesthetic-ecological integration; post-capitalist value</li><li id=""""><strong id="""">OBSOLESCES:</strong> Infinite growth ideology; brittle infrastructure; dystopian default future</li><li id=""""><strong id="""">RETRIEVES:</strong> Commons ethos; craft and artisanry augmented with appropriate technology</li><li id=""""><strong id="""">REVERSES INTO:</strong> Vibrant, desirable simplicity experienced as abundance of time, connection, and purpose</li></ul><p id=""""></p>","<p id=""""><strong>Generative DNA</strong>: Systems designed for radical democracy, sufficient flourishing, and intergenerational care as inherent rights rather than aspirational goals.</p>","<p id="""">Transition Towns</p><p id="""">Beginning in Totnes, England, Transition Towns demonstrate solarpunk aspirations through grassroots democratic organizing, focus on community resilience and sufficient rather than maximum flourishing, celebration of diverse cultural meanings of prosperity, and explicit care for generational sustainability.</p><p id=""""><em id="""">Sources:</em> <a href=""https://transitionnetwork.org/"" target=""_blank"" id="""">Transition Network</a> | <a href=""https://www.postcarbon.org/publications/"" target=""_blank"" id="""">Post Carbon Institute</a> | <a href=""https://www.resilience.org/stories/"" target=""_blank"">Resilience.org Community Studies</a></p>","<p id=""""><strong id="""">""A Psalm for the Wild-Built""</strong> by Becky Chambers (2021)</p><p id="""">Chambers's novella exemplifies SolarPunk's vision of radically democratic communities that prioritize sufficient flourishing over endless growth, featuring diverse meanings of success and deep care for future generations.</p>",civil-society,daily-life-employment,,Bhakti
Biocracy,17t,68d43be19861a99025b311ef,68da9a249126857d5ec98a82,false,false,Mon Sep 29 2025 14:39:32 GMT+0000 (Coordinated Universal Time),Sun Nov 23 2025 22:33:34 GMT+0000 (Coordinated Universal Time),Sun Nov 23 2025 22:34:12 GMT+0000 (Coordinated Universal Time),https://www.solarpunksangha.com/academy/meta-narratives/sustainable-future,"<p id=""""><em id="""">""The Earth is our mother, and we are all her children.""</em> — <strong id="""">Atharva Veda 12.1.12</strong></p>","""The Earth is our mother, and we are all her children."" — Atharva Veda 12.1.12",20,https://cdn.prod.website-files.com/64a6e8d0934bf5388f56b867/68da9d2be1f9527c79c1fad5_Biocracy.avif,🏡,✴️ Symbiotic Commonwealth,Foundational Logic,The Life Economy: Systems designed around ecological and community health.,"Circulates wealth through living systems—economics as stewardship, where surplus regenerates life, not just capital.",Bioregional Governance,Power rooted in place,Circular Economics,Waste-free production,Cultural Flourishing,Diversity as strength,Ecopolis,Cities as ecosystems,"<p id="""">How would living under <strong>Bioregional Governance</strong> change my relationship to place, and what would a local economy based on <strong>Circular Economics</strong> look and feel like on a daily basis?</p>","<p id="""">1. Do decisions honor ecological carrying capacity?</p><p id="""">2. Does the economy mimic natural systems?</p><p id="""">3. Are cities designed as ecosystems?</p>","<p id="""">- Ecological footprint vs. biocapacity</p><p id="""">- Circular economy metrics</p><p id="""">- Biodiversity correlation with human well-being</p>","<p id=""""><strong id="""">The Biospheric Liver</strong> </p><p id="""">Capacity for Metabolic Balance</p>","<p>To ensure human activity enhances, rather than depletes, the ecological systems we are part of.</p>","<p>Bioregional governance, circular economics, and rights of nature legal frameworks.</p>","<p><strong id="""">Ecological Immunity:</strong> The system's inherent ability to identify and isolate extractive elements, healing them or rendering them harmless.</p>",Systems designed around ecological and community health,"<ul id=""""><li id=""""><strong id="""">Object of Perception:</strong> Governance / Economics</li><li id=""""><strong id="""">ENHANCES:</strong> Ecological intelligence; adaptive management; place-based wisdom; circular flows</li><li id=""""><strong id="""">OBSOLESCES:</strong> Bureaucratic centralization; extractive economics; disconnection from place</li><li id=""""><strong id="""">RETRIEVES:</strong> Indigenous governance principles integrated with modern systems thinking</li><li id=""""><strong id="""">REVERSES INTO:</strong> Governance becomes as natural and invisible as healthy ecological cycles</li></ul><p id=""""></p>","<p id=""""><strong>Ecological Intelligence</strong>: Governance and economics operate on biological principles—circular flows, adaptive intelligence, and nested cooperation.</p>","<p id="""">Kerala's Local Self-Governance Model (1990s-present)</p><p id="""">Kerala State in India demonstrates biocracy through decentralized panchayat (village council) governance aligned with bioregional watersheds, participatory planning processes, circular economic initiatives, cultural preservation programs, and eco-city development in Kochi.</p><p id=""""><em id="""">Sources: </em><a href=""https://kila.ac.in/"" target=""_blank"" id="""">Kerala Institute of Local Administration</a> | <a href=""https://cds.edu/"" target=""_blank"" id="""">Centre for Development Studies</a> | <a href=""https://unhabitat.org/sites/default/files/documents/2019-05/kerala_case_study.pdf"" target=""_blank"" id="""">UN-Habitat Kerala Case Study</a></p><p>‍</p>","<p id=""""><strong>""The Ecology of Freedom""</strong> by Murray Bookchin (1982)</p><p id="""">Bookchin's vision of social ecology and libertarian municipalism provides theoretical foundation for bioregional governance, where human communities organize according to ecological principles and direct democratic participation.</p>",governance-institutions,citizenship-advocacy,,Raja
Ahimsa,18t,68d43be19861a99025b311ef,68da9a243bcf0d740f8dea9d,false,false,Mon Sep 29 2025 14:39:32 GMT+0000 (Coordinated Universal Time),Sun Nov 23 2025 22:33:34 GMT+0000 (Coordinated Universal Time),Sun Nov 23 2025 22:34:12 GMT+0000 (Coordinated Universal Time),https://www.solarpunksangha.com/academy/meta-narratives/sustainable-future,"<p id=""""><em id="""">""May all beings look at me with a friendly eye. May I do likewise, and may we all look on each other with the eyes of a friend.""</em> — <strong id="""">Yajur Veda 36.18</strong></p>","""May all beings look at me with a friendly eye. May I do likewise, and may we all look on each other with the eyes of a friend."" — Yajur Veda 36.18",21,https://cdn.prod.website-files.com/64a6e8d0934bf5388f56b867/68da9d43a07f729da8a55db9_Ahimsa.avif,🖖🏼,✴️ Symbiotic Commonwealth,Foundational Logic,Ahimsic Intelligence: Non-violence (ahimsa) is not passive but actively engineered into all systems—the positive presence of care rather than mere absence of harm.,"Designs systems where no one’s well-being requires another’s suffering—safety, health, and dignity as universal conditions.",Restorative Governance,Conflict transformation that heals rather than punishes,Harm-Free Economics,Systems designed so no one's prosperity requires another's deprivation,Cultural Reverence,Active protection and celebration of diverse meaning systems,Ecological Reciprocity,Human participation that enhances rather than depletes,"<p>How can I actively engineer non-violence into my relationships, work, and community participation?</p>","<p id="""">1. Does the system have mechanisms for repairing harm when it occurs?</p><p id="""">2. Are there feedback loops that prevent the externalization of costs?</p><p id="""">3. Does the system become more non-violent through use?</p>","<p id="""">-Restorative justice case resolution rates</p><p id="""">-Ecological regeneration metrics</p><p id="""">-Cultural diversity preservation indicators</p>","<p id=""""><strong id="""">The Nervous System of Care</strong> </p><p id="""">Capacity for Non-Harm</p>",<p>To create a society where no one's prosperity requires another's deprivation.</p>,"<p>Restorative justice, harm-free economics, and proactive conflict transformation.</p>","<p><strong id="""">Active Compassion:</strong> Responding to violence not with equal force, but with a greater force of understanding and healing.</p>",Non-violence actively engineered into all systems,"<ul id=""""><li id=""""><strong id="""">Object of Perception:</strong> Conflict / Harm</li><li id=""""><strong id="""">ENHANCES:</strong> Healing; reconciliation; trust; systemic care; proactive harm reduction</li><li id=""""><strong id="""">OBSOLESCES:</strong> Punitive justice; retributive violence; cost externalization</li><li id=""""><strong id="""">RETRIEVES:</strong> Ancient non-violence principles as active design in modern systems</li><li id=""""><strong id="""">REVERSES INTO:</strong> Non-violence becomes the default condition, with violence seen as system design failure</li></ul><p id=""""></p>","<p id=""""><strong>Engineered Ahimsa</strong> - Non-violence as an active design principle, not just an ethical preference.</p>","<p>Restorative Cities like Hull, UK implementing city-wide restorative approaches.</p>","<p id=""""><strong>""Active Hope (revised)""</strong> by Joanna Macy (2022) </p><p id="""">Moving beyond hope to active non-violent participation and self-empowerment.</p>",civil-society,safety-security,,Karma
Symbiotic Ethos,19t,68d43be19861a99025b311ef,68da9a241b6755933af56449,false,false,Mon Sep 29 2025 14:39:32 GMT+0000 (Coordinated Universal Time),Sun Nov 23 2025 22:33:34 GMT+0000 (Coordinated Universal Time),Sun Nov 23 2025 22:34:12 GMT+0000 (Coordinated Universal Time),https://www.solarpunksangha.com/academy/meta-narratives/sustainable-future,"<p id=""""><em id="""">""The hand and foot feel the need of one another; all the senses and their objects are mutually dependent. All beings are helpful to one another.""</em> — <strong id="""">Sutta Nipata</strong></p>","""The hand and foot feel the need of one another; all the senses and their objects are mutually dependent. All beings are helpful to one another."" — Sutta Nipata",22,https://cdn.prod.website-files.com/64a6e8d0934bf5388f56b867/68da9d94ce3c0cd81dd54c8f_Symbiotic%20Ethos.avif,🪸,✴️ Symbiotic Commonwealth,Systemic Expressions,"The Pro-Social Core: Rewarding cooperation, care, and long-term thinking.","Cultivates relational, empathetic leadership that circulates power through trust, cooperation, and mutual aid.",Relational Wisdom,Decisions through community relationships,Cooperative Advantage,Thriving by lifting others,Empathetic Intelligence,Understanding as a superpower,Stewardship Joy,Fulfillment from care,"<p id="""">Where can I practice <strong>Relational Wisdom</strong> and <strong>Empathetic Intelligence</strong> today to experience the <strong>Cooperative Advantage</strong> over competition, and find <strong>Stewardship Joy</strong> in caring for people and planet?</p>","<p id="""">1. Does helping others improve your own position?</p><p id="""">2. Are conflicts resolved through understanding or power?</p><p id="""">3. Does the system reward trust-building?</p>","<p id="""">- Social capital measurements</p><p id="""">- Empathy and cooperation indices</p><p id="""">- Conflict resolution effectiveness</p>","<p id=""""><strong id="""">The Mycelial Network</strong> </p><p id="""">Capacity for Relational Intelligence</p>","<p>To leverage our differences as collective strength, creating societies that thrive on mutual aid.</p>","<p>Cooperative ownership, shared leadership, and rituals that celebrate interdependence.</p>","<p><strong id="""">Relational Fidelity:</strong> The community's commitment to protecting the bonds of trust, isolating behaviors that exploit or divide.</p>","Rewarding cooperation, care, and long-term thinking","<ul id=""""><li id=""""><strong id="""">Object of Perception:</strong> Social Interactions</li><li id=""""><strong id="""">ENHANCES:</strong> Trust; social capital; collective intelligence; mutual support; long-term relationships</li><li id=""""><strong id="""">OBSOLESCES:</strong> Zero-sum competition; hyper-individualism; short-term opportunism</li><li id=""""><strong id="""">RETRIEVES:</strong> Village/tribal cooperation at scale in complex societies</li><li id=""""><strong id="""">REVERSES INTO:</strong> Cooperation becomes so natural it's no longer seen as strategy but as water we swim in</li></ul><p id=""""></p>","<p id=""""><strong>Relational Metabolism</strong>: The system's social chemistry operates on empathy, cooperation, and mutual advantage as default settings.</p>","<p id="""">Indigenous Forest Management in Pacific Northwest (ongoing)</p><p id="""">Traditional ecological knowledge of Coast Salish peoples demonstrates symbiotic ethos through controlled burning practices that increase biodiversity, salmon habitat restoration that benefits entire watersheds, and governance systems based on seven-generation thinking.</p><p id=""""><em id="""">Sources: </em><a href=""https://nwifc.org/"" target=""_blank"" id="""">Northwest Indian Fisheries Commission</a> | <a href=""https://www.traditionalanimalfoods.org/"" target=""_blank"" id="""">Traditional Ecological Knowledge Institute</a> | <a href=""https://depts.washington.edu/ntplants/"" target=""_blank"">University of Washington Ethnobotany</a></p>","<p id=""""><strong>""Braiding Sweetgrass""</strong> by Robin Wall Kimmerer (2013)</p><p id="""">Kimmerer weaves indigenous knowledge with scientific understanding to demonstrate relational wisdom, showing how humans can find cooperative advantage through empathetic intelligence and experience stewardship joy in reciprocal relationships with more-than-human world.</p>",civil-society,daily-life-employment,,Bhakti
Materialist Reductionism,1t,68d43be19861a99025b311ef,68da9a2372822767794b0a00,false,false,Mon Sep 29 2025 14:39:31 GMT+0000 (Coordinated Universal Time),Sun Nov 23 2025 22:33:34 GMT+0000 (Coordinated Universal Time),Sun Nov 23 2025 22:34:12 GMT+0000 (Coordinated Universal Time),https://www.solarpunksangha.com/academy/meta-narratives/the-necrocene,"<p id="""">""We are forced to make these difficult decisions because of their barbaric nature.""</p>","""We are forced to make these difficult decisions because of their barbaric nature.""",1,https://cdn.prod.website-files.com/64a6e8d0934bf5388f56b867/68da9a842e3ee90bdc5287f5_Materialist%20Reductionism.avif,⛓️,🦠 Necrocene,Metaphysical Ground,"The Dead Universe: The foundational belief that consciousness is an accidental byproduct of matter, rendering the universe fundamentally meaningless and mechanical.","Reduces consciousness to matter to justify treating people, animals, and ecosystems as inert resources to be controlled and owned.",Mechanistic Governance,Society as a machine to be optimized through control and surveillance,Resource Computation,Value reduced to quantifiable metrics; living systems as inventory,Epiphenomenal Culture,"Art, meaning, and spirituality as evolutionary byproducts without inherent significance",Dead Nature,Environment as interchangeable parts in a planetary machine,"<p id="""">Do my daily actions—my <strong>consumption</strong>, my <strong>voting</strong>, my <strong>work</strong>—reinforce a system that treats living beings as resources and the Earth as inventory, making me complicit in my own spiritual depletion?</p>","<p id="""">1. Does the system treat consciousness as a problem to be solved rather than a reality to be embraced?</p><p id="""">2. Are qualitative experiences reduced to quantitative data?</p><p id="""">3. Is meaning treated as a subjective illusion?</p>","<p id="""">- Reductionist scientific paradigm dominance</p><p id="""">- Spiritual/meaning crisis prevalence</p><p id="""">- Treatment of animals/nature as insentient</p>","<p id=""""><strong id="""">The Soul</strong></p><p id="""">The Capacity to Wonder</p>",<p>To eliminate moral responsibility by framing Them as less than fully human.</p>,"<p>Systematic dehumanization in media and political rhetoric (""human animals,"" ""terrorist infrastructure"").</p>","<p><strong id="""">Scientism</strong>: Framing the conflict as a technical security problem rather than a moral crisis.</p>",The foundational belief that consciousness is an accidental byproduct of matter,"<ul id=""""><li id=""""><strong id="""">Object of Perception:</strong> Reality / The Universe</li><li id=""""><strong id="""">ENHANCES:</strong> Predictive control over physical systems; quantifiable efficiency; instrumental reason</li><li id=""""><strong id="""">OBSOLESCES:</strong> Subjective experience (qualia); intrinsic meaning; spirituality; consciousness as fundamental</li><li id=""""><strong id="""">RETRIEVES:</strong> Pre-Socratic atomism; brutalist ""honesty"" that rejects superstition</li><li id=""""><strong id="""">REVERSES INTO:</strong> Spiritual vacuum fueling irrationality and conspiracy theories; the enhanced control flips into profound loss of <em id="""">self</em>-control and agency</li></ul><p id=""""></p>","<p id=""""><strong>Metaphysical Nihilism</strong> - The universe is ultimately dead matter, making exploitation ""rational"" and meaning a personal fiction</p>","<p id="""">Behavioral Economics</p><p id="""">How human decisions are reduced to algorithmic patterns and manipulated for profit. Exemplifies operationalizing the materialist view of humans. It reduces human decision-making to predictable algorithmic patterns that can be manipulated for efficiency or profit. This aligns with Necrocene's ""Homo Economicus"" and the reduction of human experience to data points</p>","<p id=""""><strong>""Consciousness Explained""</strong> by Daniel Dennett (1991)</p><p id="""">Provides the philosophical bedrock for the Necrocene. Dennett argues consciousness is an illusion produced by material processes, perfectly justifying a worldview where only measurable, physical things are ""real."" This is the intellectual basis for treating the world as dead inventory</p>",civil-society,healthy-living,,Jnana
